{
  "id": "core",
  "name": "Core Rules",
  "version": "1.0.0",
  "description": "Basic races, classes, and backgrounds for character creation",
  "author": "Character Wizard",
  "races": [
    {
      "id": "human",
      "name": "Human",
      "description": "Versatile and ambitious, humans are the most adaptable of all races.",
      "abilityBonuses": {
        "strength": 1,
        "dexterity": 1,
        "constitution": 1,
        "intelligence": 1,
        "wisdom": 1,
        "charisma": 1
      },
      "traits": ["Extra Language", "Extra Skill"],
      "speed": 30,
      "languages": ["Common", "One additional language"]
    },
    {
      "id": "elf",
      "name": "Elf",
      "description": "Graceful and long-lived, elves are known for their magical affinity.",
      "abilityBonuses": {
        "dexterity": 2
      },
      "traits": ["Darkvision", "Keen Senses", "Fey Ancestry", "Trance"],
      "speed": 30,
      "languages": ["Common", "Elvish"]
    },
    {
      "id": "dwarf",
      "name": "Dwarf",
      "description": "Stout and hardy, dwarves are master craftsmen and fierce warriors.",
      "abilityBonuses": {
        "constitution": 2
      },
      "traits": ["Darkvision", "Dwarven Resilience", "Stonecunning"],
      "speed": 25,
      "languages": ["Common", "Dwarvish"]
    },
    {
      "id": "halfling",
      "name": "Halfling",
      "description": "Small but brave, halflings are known for their luck and stealth.",
      "abilityBonuses": {
        "dexterity": 2
      },
      "traits": ["Lucky", "Brave", "Halfling Nimbleness"],
      "speed": 25,
      "languages": ["Common", "Halfling"]
    }
  ],
  "classes": [
    {
      "id": "fighter",
      "name": "Fighter",
      "description": "Masters of martial combat, skilled with weapons and armor.",
      "hitDie": 10,
      "primaryAbility": ["strength", "dexterity"],
      "savingThrows": ["strength", "constitution"],
      "skillChoices": {
        "count": 2,
        "options": ["Acrobatics", "Animal Handling", "Athletics", "History", "Insight", "Intimidation", "Perception", "Survival"]
      },
      "startingEquipment": ["Chain mail or leather armor", "Martial weapon and shield or two martial weapons", "Light crossbow and 20 bolts or two handaxes"],
      "features": [
        {
          "name": "Fighting Style",
          "level": 1,
          "description": "Choose a fighting style specialty."
        },
        {
          "name": "Second Wind",
          "level": 1,
          "description": "Regain hit points equal to 1d10 + fighter level as a bonus action."
        },
        {
          "name": "Action Surge",
          "level": 2,
          "description": "Take one additional action on your turn."
        }
      ]
    },
    {
      "id": "wizard",
      "name": "Wizard",
      "description": "Scholarly magic-users who wield arcane power through study.",
      "hitDie": 6,
      "primaryAbility": ["intelligence"],
      "savingThrows": ["intelligence", "wisdom"],
      "skillChoices": {
        "count": 2,
        "options": ["Arcana", "History", "Insight", "Investigation", "Medicine", "Religion"]
      },
      "startingEquipment": ["Quarterstaff or dagger", "Component pouch or arcane focus", "Scholar's pack or explorer's pack", "Spellbook"],
      "features": [
        {
          "name": "Spellcasting",
          "level": 1,
          "description": "Cast wizard spells using Intelligence as your spellcasting ability."
        },
        {
          "name": "Arcane Recovery",
          "level": 1,
          "description": "Recover spell slots during a short rest."
        }
      ]
    },
    {
      "id": "rogue",
      "name": "Rogue",
      "description": "Skilled in stealth and deception, striking from the shadows.",
      "hitDie": 8,
      "primaryAbility": ["dexterity"],
      "savingThrows": ["dexterity", "intelligence"],
      "skillChoices": {
        "count": 4,
        "options": ["Acrobatics", "Athletics", "Deception", "Insight", "Intimidation", "Investigation", "Perception", "Performance", "Persuasion", "Sleight of Hand", "Stealth"]
      },
      "startingEquipment": ["Rapier or shortsword", "Shortbow and quiver of 20 arrows or shortsword", "Burglar's pack, dungeoneer's pack, or explorer's pack", "Leather armor, two daggers, thieves' tools"],
      "features": [
        {
          "name": "Expertise",
          "level": 1,
          "description": "Double proficiency bonus for two skills."
        },
        {
          "name": "Sneak Attack",
          "level": 1,
          "description": "Deal extra damage when you have advantage or an ally nearby."
        },
        {
          "name": "Thieves' Cant",
          "level": 1,
          "description": "Secret language known only to rogues."
        }
      ]
    },
    {
      "id": "cleric",
      "name": "Cleric",
      "description": "Divine spellcasters who serve the gods and heal the wounded.",
      "hitDie": 8,
      "primaryAbility": ["wisdom"],
      "savingThrows": ["wisdom", "charisma"],
      "skillChoices": {
        "count": 2,
        "options": ["History", "Insight", "Medicine", "Persuasion", "Religion"]
      },
      "startingEquipment": ["Mace or warhammer", "Scale mail, leather armor, or chain mail", "Light crossbow and 20 bolts or any simple weapon", "Priest's pack or explorer's pack", "Shield and holy symbol"],
      "features": [
        {
          "name": "Spellcasting",
          "level": 1,
          "description": "Cast cleric spells using Wisdom as your spellcasting ability."
        },
        {
          "name": "Divine Domain",
          "level": 1,
          "description": "Choose a divine domain that grants special features."
        }
      ]
    }
  ],
  "backgrounds": [
    {
      "id": "soldier",
      "name": "Soldier",
      "description": "You served in an army and know military discipline.",
      "skillProficiencies": ["Athletics", "Intimidation"],
      "toolProficiencies": ["Gaming set", "Vehicles (land)"],
      "equipment": ["Insignia of rank", "Trophy from fallen enemy", "Gaming set", "Common clothes", "10 gp"],
      "feature": {
        "name": "Military Rank",
        "description": "Soldiers loyal to your former organization recognize your authority."
      }
    },
    {
      "id": "sage",
      "name": "Sage",
      "description": "You spent years learning the lore of the multiverse.",
      "skillProficiencies": ["Arcana", "History"],
      "languages": 2,
      "equipment": ["Bottle of black ink", "Quill", "Small knife", "Letter with unanswered question", "Common clothes", "10 gp"],
      "feature": {
        "name": "Researcher",
        "description": "You know where to find information you don't know."
      }
    },
    {
      "id": "criminal",
      "name": "Criminal",
      "description": "You have a history of breaking the law.",
      "skillProficiencies": ["Deception", "Stealth"],
      "toolProficiencies": ["Gaming set", "Thieves' tools"],
      "equipment": ["Crowbar", "Dark common clothes with hood", "15 gp"],
      "feature": {
        "name": "Criminal Contact",
        "description": "You have a reliable contact in the criminal underworld."
      }
    },
    {
      "id": "acolyte",
      "name": "Acolyte",
      "description": "You have spent your life in service to a temple.",
      "skillProficiencies": ["Insight", "Religion"],
      "languages": 2,
      "equipment": ["Holy symbol", "Prayer book", "5 sticks of incense", "Vestments", "Common clothes", "15 gp"],
      "feature": {
        "name": "Shelter of the Faithful",
        "description": "You can receive free healing and care at temples of your faith."
      }
    }
  ]
}
